{
  "mode": "goal",
  "objective": "Replace with the task objective",
  "exit_condition": "Replace with an explicit completion or stopping condition",
  "status": "in_progress",
  "iteration": 0,
  "phases": [
    {
      "name": "",
      "status": "todo"
    }
  ],
  "current": {
    "focus": "",
    "next_action": "",
    "blockers": ""
  },
  "decisions": [],
  "verify_cmd": "",
  "updated_at": "",
  "verify_observation": "Replace with a repeatable read-only completion check"
}
